urla,urlA,story_urlA,risk_urlA,urlb,urlB,story_urlB,risk_urlB
https://www.kickstarter.com/projects/873496133/mental-play?ref=discovery_category_newest,873496133/mental-play,"Tamsin Flower - Writer/DirectorMarc Atkinson - Filmmaking/AV DesignCast - (East 15 graduates - Rebecca Finch, Cal Jones, Simon White and Bev Bishop).Script Development - Patrick Morris and Fraser GraceSupported by: Hotbed Festival of New Writing, Menagerie Theatre, Norwich Arts Centre, Writers' Centre Norwich, ACE and NCC",Some challenges we may face in sharing this work following it's R&D process may include -Securing support from three further venues.Providing 'Match Funding' for a further GfA grant of £15kIdentifying a producer/advocate to assist the director in transferring the project to three further venues.I (Tamsin) am actively cultivating relationships with partner venues and advocates.,https://www.kickstarter.com/projects/873496133/mental-play-short-tour-2015?ref=discovery_category_newest,873496133/mental-play-short-tour-2015,"MENTAL Play is an hour-length narrative that combines, rhythmical drama, poetry and original films to tell the story of three twenty-somethings on a pilot mental health support programme.We at newly formed company, Stream Lyric, aim to tour this fun and politically/socially relevant play to four confirmed theatre/studio-theatre venues in the East and London during 2015. (For more details of the venues that have committed to the tour message Tamsin.) We now seek match-funding to consolidate our ACE tour application and need £200 of support via this campaign!MENTAL Play’s R&D process featured a work in progress showing at Hotbed Festival of New Writing (Cambridge Junction) and Norwich Arts Centre in 2014 as supported by ACE, NCC, Writers’ Centre Norwich (The National Centre for Writing) and Norwich Mind*. We were successful in drawing myriad audiences from mental health client groups, student communities and the regular theatre going public, a significant number of whom had only attended theatre once previously.Testimonials for the show -	'Tamsin Flower’s play is deftly directed and utterly convincing, with strong performances by the cast. The text explores the difficult issues around mental health without flinching. The characters conflicting needs are brought vividly to life and uncomfortable truths explored. A challenging and original piece of theatre.’   Martin Figura (Spoken Word Artist)Craig Baxter (Award Winning Playwright) - ‘MENTAL Play is a bold, ambitious and original piece of dramatic writing.’	‘Really glad I made it to see Mental Play. I loved the moments of heightened lyricism (e.g. memories of a beach with little water or sun) - those moments have really stayed with me.               Andrew Burton (Arts Marketeer & Writer)","To make our tour application strong, we need your support to contribute towards match-funding. We aim to raise £1,300 but understand that the financial climate is tough and would welcome any contribution (our crowd-funding target is £200).We have a remarkably strong offer in having confirmed dates at four key theatre development venues and a week-long company residency, as supported by an outreach partnership with Mind* The team consisting of Tamsin Flower (Writer-Director), Marc Atkinson (Flimmaker), Ida Casilli (Tour Manager) and East 15 graduate Actors: Simon White, Rebecca Finch and Cal Jones, are ready to roll-out this short tour with passion, precision and a genuine desire to reflect on the challenges modern life poses to the young and vulnerable."
https://www.kickstarter.com/projects/christiancore/cmb-praise-metal-revolution?ref=discovery_category_newest,christiancore/cmb-praise-metal-revolution,"I am raising money to launch my next EP ,""Praise Metal Revolution."" Praise Metal Revolution is exactly what it sounds like, modern christian worship songs taken and remade into brutal, heavy metal instrumentals, and is for the Christians out there who enjoy music that is a lot heavier and more Passionate!I normally do metal instrumentals, but with this project I want to step things up and add vocals! So there will be two versions of Praise Metal Revolution, one with vocals and an instrumental version.When I was first getting into metal music, the Christian metal bands I listened to inspired me in so many ways. Christian Metal isn't just music it is a community that encouraged me and welcomed me in. As a heavy metal guitarist you can kinda figure that when I wanted to play in church people didn't like the idea, they got over it though and I started playing in church just nothing super wild. The more I served with my talent as a guitarist the more I felt God calling me to building a ministry and a career in music. I have been making music since, and the reason why is I want to inspire you with my music the way my favorite bands reached out and inspired me even in the ashes of defeat.This is why I am making Praise Metal Revolution, it is not just for my career, it is more for the ministry and I will give it everything I got to make it the best I can, and trust God to step in and do what only He can do. May God be glorified with what happens with this project!So let's talk about some of the rewards, this will be FUN!!!Here is a video I did to explain the rewards.Here is my Latest Album Metalcore Symphony Volume II. I just released it on the launch day for this fundraiser, and the first 10 backers will get a free download of this!If you guys are wondering about my previous EP Metalcore Symphony here it is so go ahead and headbang to it!Here is my Ep FollowCore Standing Alone! You can Jam to it as well!!!","The main thing I am not sure about is how long it will take to get everything done and shipped out and how long that will take to ship, so I put December of this year as the shipping date, it could be sooner and I will do everything I can to make sure it's not later!",https://www.kickstarter.com/projects/christiancore/cmb-metalcore-symphonies-cds?ref=discovery_category_newest,christiancore/cmb-metalcore-symphonies-cds,"Help me make Physical CDs! Last year I released two records, Metalcore Symphony, and Metalcore Symphony Volume II. These like all my releases are self released and I do not have the funding to make physical cds but I asked all of you my fans about doing a fundraiser to make some and had many people who wanted to have physical cd's!So I am putting the two symphonies put into one cd compilation as well as a few other releases that will make a 20 track cd. Doing this as a compilation cd would also help to save on costs of making the cd, so if 8 people pledge 25 for the physical cd we will reach our goal of 200 very easily! If we make it way past that if God is willing, I will have merch made like t-shirts and jackets made, definitely beanies!If you haven't heard my music before here are the releases that will be on the cd's.Here is my latest EP Deathcore Symphony that will be a bonus to the two symphonies!This is a Christmas song, a cover for Carol Of The Bells.","I am sorry that the shipping costs are kind of high for those not in the U.S. I am unsure how much it would be having the cd's sent in different parts of the world, that is the only reason the shipping costs are high, I plan on doing all the packaging and shipping myself so I want to make sure I can get it to you guys!"
https://www.kickstarter.com/projects/lukestonestudios/project-13-cd?ref=discovery_category_newest,lukestonestudios/project-13-cd,"We believe that God can use music to do some amazing and powerful things. Too often the restriction of cost keeps the people who need the music from getting it. With this project we are trying to rethink the way we do things. By partnering with our friends and supporters to produce this CD we will be able to offer it for a FREE WILL DONATION to who ever needs it. If you can give $.01 or $100, it doesn't matter. This way the music gets into the hands of those who needs it most. Thank you for prayerfully considering your support of this project.","We are currently writing the CD.  Join our mailing list and get exclusive updates to the project.  As we get material ready we will be tracking and sending those tracks off to a producer to complete the project.  Once this is done, we will send the master over to production and get our hard copies ready for distribution!",https://www.kickstarter.com/projects/lukestonestudios/hybrids-sons-of-gods-3?ref=discovery_category_newest,lukestonestudios/hybrids-sons-of-gods-3,"Hybrids: The Sons of Gods is not your typical Superhero book. Using ancient documents like the Bible and the Book of Enoch, reality and fantasy converge with blurred lines. The Hybrids are the genetic ancestors of the ancient Nephilim! Though this lends to a very action packed and massively overpowered heroes, it's the humanity of the story that takes center stage. Our characters deal with love, loss, and faith in a very real, very human way. Hybrids is just one part of the epic shared universe being created by Star Cross Comics. Over the next few months we have slotted to release issues 4 and 5 of Hybrids to wrap up this first arc. ","With this current issue, the risks are low.  After the release of the first issue, we changed publishers and did a soft release of issue 2.  Our biggest challenge is getting the comics into the readers hands.  That is where things like Kickstarter come into play.  Through this platform we will be able to distribute the first 3 issues.  The next 2 issues are currently being produced right now!  If you support this Kickstarter, you will be able to do so with confidence.  Production is done for all three issues and the rewards.  All we will be waiting on is the printer.  This will all be done through the power of Star Cross Comics and their affiliates."
https://www.kickstarter.com/projects/1489651350/ubotia-pipanther-a-raspberry-pi-on-tracks?ref=discovery_category_newest,1489651350/ubotia-pipanther-a-raspberry-pi-on-tracks,"…a Raspberry Pi on tracks!Project site: http://www.ubotia.com/The Robot is powered by a Raspberry Pi and is build for modding. Out of the box PiPanther is equipped with WIFI, HD camera and is controlled by a smartphone app. But an API means anyone can create their own turret additions!      The PiPanther Robot is a smart, fast and compact vehicle. As it explores rooms, you can set up battlefields anywhere and fight your mates using the Ubotia Software. Yet the PiPanther is much more than just a future tank! You can customize it by changing guns to any other plugins: e.g. with a LED Torch Plugin you can explore hidden terrain under your bed or behind your wardrobe!Prepare your PiPanther – a Raspberry Pi powered RobotSetup WiFi connection, enter name of your robot, upload your avatar, choose plugins you need.Arrange your own Ubotia WorldArrange your own home or office space – you can use every single everyday item to create labyrinths and paths, hideouts and sniper’s nests. A chair, a book, your wife’s shoes? And – last but not least – the more rooms within your WiFi, the more exciting the battlefield.Set up your mobile deviceDownload & install the Ubotia App for your Android or iOS device.Go for “active robots”, find your own vehicle and log in.Ready… Steady… Go!Fight!Yes, for sure your home or office space is looking kind of strange from PiPanther’s point of view, like you’ve never seen it before. That’s why is not easy to find a safe way through your own Ubotia World, full of enemies. You’d better watch out! Or shoot them all ;-)Customize your PiPanther RobotYou can also have even more fun extending your PiPanther Robot. You can create your own hardware plugins using an open API to develop new modules and tools. Join Ubotia this way!Create your own Raspberry Pi powered RobotYou want to experience a Robot in your home, but you don’t like tanks and fights? PiPanther’s mainboard together with Raspberry Pi and UbotiaApp is the perfect set you can use to control your own mobile robot with a live streaming camera on board, matching your needs.You will get compact sized and powerful 5V DC adapter, a Li-Po charger, double DC motor driver and double servo controller on one PCB.Together with the PiPanther’s mainboard you are free to use the Ubotia App for your own robot.","The PiPanther ver. 1.1 is a prototype generation. The v1.1 vehicles were used as a proof of concept of the Ubotia Project. We have had so much fun playing them, however we decided that few things need to be fixed in the ver. 1.2. We’re going to work on:- Simplify the casing construction – to make assemble/disassemble easier,- Change the Plugin Sockets – use just one instead of two pin headers per socket and add mounting screws for larger (heavier) custom plugins,- Add a color backlight to the chassis – it will be possible to choose a common color for a team to easily tell enemies from teammates,- We’re open for any other suggestions/improvements.",https://www.kickstarter.com/projects/1489651350/beautiful-electronics-rapidradio-cutest-raspberryp?ref=discovery_category_newest,1489651350/beautiful-electronics-rapidradio-cutest-raspberryp,"The rapidradio is the simplest wireless connectivity for your Raspberry Pi. Just plug it in and use the rapidradio command-line tool.Full rapidradio source code is available at GitHub. It's free to use and modify (MIT License).You could just solder manually 8 wires to the tiny RFM75 radio, that's true. But Raspberry Pi looks so pretty with the rapidradio and we all love working with beautiful designed devices, don’t we?Isn’t it just beauty? No, it’s not. It is beauty and it works! How cool is that?rapidradio means the simplest wireless connectivity for your Raspberry Pi.It’s a half-duplex 2.4GHz transceiver based on the RFM75 module (made by HopeRF). It’s a perfect solution for any kind of home automation, robotics, DIY projects, Arduino-to-RaspberryPi projects etc.You will be surprised how much you can reach using rapidradio. So much opportunities and so much fun, because it will work for you both ways – for your projects and for your taste. Enjoy!Dimensions (L x W x H):27mm x 21mm x 12mmVoltage:1.9V – 3.6V, I/Os are 5V-tolerantInterface: SPIup to 8MHzRF features:RF power programmable: -35 .. +5dBm; 2.4000-2.4835 GHz ISM band (83 channels), 4-byte addressesSpeed:max. 2Mbit, but practical usable up/down stream is lower when all CRC, ACK, auto-repeat, etc. options are enabled.Open area range:~70m; improved indoor range by rapidradio wire antenna in comparison to the RFM73’s pcb antennaHow to set up rapidradio? don’t worry, it’s a child’s play.Just plug it in to your Raspberry Pi as shown on the pictures below – meaning into the inner pin column, starting from the 6th pin from bottom (true for all current Raspberry Pi versions).Do not forget to switch-off and unplug Raspberry Pi first (just in case).Then get the rapidradio tool. You can download compiled binary here (Raspbian Wheezy).or you can build it from source on your own.Now you are ready for a transmission!Start listening using address 0x12345678 and channel 50:sudo ./rapidradio -l -a=0x12345678 -c=50 > received_file.txtThen on second Raspberry Pi use this command to send a 'sample_file.txt' to the listening rapidradio you’ve just set (address 0x12345678 and channel 50):sudo ./rapidradio -a=0x12345678 -c=50 < sample_file.txtYou’ve just sent a file. A child’s play, wouldn’t you agree?We have a thing for beauty - let us introduce the rapidradio thing. It's a tiny node for your rapidradio-powered Internet of Things.It's 5V powered and contains:GPIOs can be configured as:It runs our open source Mesh Network Lib on board, so it can act as: end/middle/mixed node to give you true mesh network.And again - it's super easy to use - just press one button to initially log it into your IoT network and starting from that time it can be hot plug-in and plug-out. With the rapidradio things your RaspberryPi becomes a gateway for the IoT. It can gather data from sensors and control any device connected to the rapidradio things. Now you can just log the data, present it as a website or send it to a cloud - it's up to you! We give you our open source software including libraries and ready to use command-line tools.It's brilliant, isn't it?Yes, you can use the rapidradio with your Arduino board too! Detailed description and sketch source files can be found on this page.We are working on a cute rapidradio family extension: the rapidradio USB. It will let you talk to your rapidradio-powered RaspberryPi or any other rapidradio-powered devices from a PC or Mac. Just plug it into an USB port and use the open source command line tool or the rapidradio USB library.There are so many possible applications the rapidradio is usefull for, it would take us one thousand and one night to tell you about all of them. But to make a picture of how much you can need our cute rapidradio we’ve listed some ideas:  …and much more. the only limits for the buttefly is the sky because… it’s cute, it’s rapid and it works.Dear Backers - thanks to you the rapidradio project hit its funding goal very quickly. Now it's time to add more sugar for you!When we say that there is plenty of usage for rapidradio we really mean it. Even if you are not familiar either with RaspberryPi or with electronics at all, you can still enjoy the beautiful design of rapidradio.Feel free to use the butterfly shaped PCB outside the electronic world! No offense taken! ;-) You can have it as unique modern jewellery or an awesome keyholder or… all the items you can come up with!   ","Actually, there is one risk - for you to fall in love with it! ;-)And more seriously, we are currently working on the whole rapidradio family of devices: 433MHz, 868MHz and 915MHz versions for extremely good through-wall range but lower data transfer rates. We are also going to prepare the 'rapidradio max' edition for those who need extreme long range devices. The main challenge is to keep as high quality of hardware and open source software as possible. And of course to make them as pretty as the first rapidradio is!"
https://www.kickstarter.com/projects/etherealnight/chibi-hero-acrylic-pins?ref=discovery_category_newest,etherealnight/chibi-hero-acrylic-pins,"We are Etherealnightcreations and welcome to our second kickstarter.This time we bring you these cute acrylic pins inspired by BNHA! These pins will be roughly 30mm in size on clear acrylic with a single bakcing post and a rubber clutch!We have so far created five different characters and are hoping to put five more into production within the process of this KS! Once our goal is reached you will be able to choose from all 10 of the designs at a special discounted KS price!Here is a picture of the first five pins!If our inital goal is met more characters may be unlocked as stretch goals!The first five pins are available to purchase on our Etsy - HERE! (On etsy they're sold for a slightly higher price.)Check us out on Instagram!⭐The campaign will run for only 21 days! So if you see a design you like, do consider pledging.⭐Timeline!It will take about 2 weeks for us to recive the funds then another two weeks for the products to be made so we hope to have everything good to go by 4-6 weeks!","Rewards can get lost in the post, but we will do all we can to make sure you recieve your rewards. If your pins do not show up, we shall send them again.Do note that by default your postage will not have tracking in order to reduce costs for you. If you would like your package to be tracked, just add £2 (for UK) or £6 (for international) to your pledge and notify us in the reward survey.",https://www.kickstarter.com/projects/etherealnight/dripping-with-pride?ref=discovery_category_newest,etherealnight/dripping-with-pride,"Hey there and welcome to our second enamel pin Kickstarter. Here at Ethereal Night Creations, we are three siblings making and creating cute fan merch here on the internet and at conventions (when safe to do so of course). As a part of the rainbow family ourselves we wanted to celebrate our pride with these cute 'dripping with pride' lip enamel pins.Our Etsy! Our Instagram!So why are we using Kickstarter? Well, with Kickstarter you can pledge now and pay later once the campaign ends. You can increase, decrease or even cancel your pledge anytime throughout the campaign, which is really simple and easy to do. As this is an all or nothing campaign, if our goal isn't met you wont be charged. You can also pledge now for any locked rewards which will help towards getting them unlocked.We have successfully unlocked the first four pins designs. That is the Rainbow, Lesbian, Bisexual and Transgender.The next three designs are all unlocked!!!!Final product may be slightly different/ have slight colour variations.Available as add ons or to be pledged for them on their own, we have Stickers, Badges and Prints.All of these options are UNLOCKED!As well as the dripping lip design, we also have the designs below available as 58mm Badges and Large stickers in our etsy shop. These can be pledged during this kickstarter on their own or as add-ons with your pin pledge.Stickers (roughly 80mm) - £0.50 each (50p)58mm Badges - £2 eachAlso the four prints (shown below) can be pledged for, they will be 148mmx148mm and printed on 300gsm card. Three extra prints for Pansexual, Asexual and Non-Binary are current in progress.Final print images may change slightly.Prints - £3.All priced are in GBP.The Kickstarter campaign will run for four weeks, after that it will take about two weeks to receive the funds during this time we will send out surveys to collect the information about which designs you would like to receive for your pledges. The pins will take about five weeks to make and be sent to us so we are looking at about mid October for all rewards to be received by backers. However we will be keeping you all constantly updated as time goes one as especially during these times shipping may be delayed.When will the funds be taken?All money will be taken once the campaign has finished, and then only if we meet our initial goal of £200.How do I pick what design I would like?If successful we will send out a detailed survey where you can pick the designs you would like to receive, plus if you have paid for any add-ons this will also be when we will ask for that information.Lastly we would just like to say a big thank you for anyone checking out this Kickstarter!We are still a pretty new business and the support we have received in the past on ks/instagram and etsy has been absolutely wonderful.","We may face some unexpected challenges, there may be some unexpected delays. However, we are determined to get these out and want to share the best product we can."
