urla,urlA,story_urlA,risk_urlA,urlb,urlB,story_urlB,risk_urlB
https://www.kickstarter.com/projects/fangirlpins/my-heart-keeps-singing-enamel-pins?ref=discovery_category_newest,fangirlpins/my-heart-keeps-singing-enamel-pins,"FangirlPins is an Etsy shop selling enamel pins inspired by everyone's favourite fandoms.All pledges will be going towards the production costs of the ""My Heart Keeps Singing"" enamel pins.Production turn around is approximately two weeks from the order date.Rewards will be posted 3-5 working days from the date of the pins' arrival from production.Rewards will be posted via Royal Mail 1st Class for UK or Royal Mail International Standard.Any stock left over after rewards are sent will be added to my shop. Pins are sold for a slightly larger cost on Etsy so not only will you be helping a small Etsy business by pledging, you will also be getting a FangirlPins pin at a cheaper price!Examples of my previous works can be seen at my Etsy shop or Instagram @FangirlPins.Happy Pledging!",It is possible that some of the pins received from manufacturing can have flaws. I will examine all of the pins before they are shipped to make sure that you do not receive a flawed pin.I will order more pins than needed to fulfil the pledges.,https://www.kickstarter.com/projects/fangirlpins/beast-and-floral-friends-enamel-pins?ref=discovery_category_newest,fangirlpins/beast-and-floral-friends-enamel-pins,"Hi everybody,Many of you may already know about my Etsy shop, FangirlPins. Well, this project is to help produce these amazing Disney inspired designs (pictured).You can look at my shop at fangirlpins.etsy.com to see what I already sell. The designs in this project will be made at 45mm in soft enamel.I already have a new manufacturer ready to produce these designs.If any spares are made, they will be added to the shop at a higher price. I can't guarantee there will be spares to add to my shop.",Pin manufacturers can often supply pins with minor flaws. I hope to be able to order spares to make sure pledges can be fulfilled.
https://www.kickstarter.com/projects/366939575/beatlounge-chillout-lifestyle-002?ref=discovery_category_newest,366939575/beatlounge-chillout-lifestyle-002,"So you ask yourself: ""What is BeatLounge""?BeatLounge as a very rough idea was born in early 2005, as a place were my passion for electronic ""Chillout Music"" and technology would merge. Back then it was called ""ADream Music"", and worked only as a 2 hours long weekly podcast, that would be uploaded to a very simple website and aired on a couple FM radios from Argentina as well.Life would happen and things would stay the same for many, many years, but I never lost track of what I wanted to achieve and exactly where I wanted to take the project to. In 2010 I gather a new staff and re-name the podcast to ""BeatLounge"", and 2 years later, in March 2012 and as a result of an excessive explosion on our social networks I decide to take the next logical step: transform the weekly podcast into a 24/7 Online Radio, offering a unique and original product where different styles as Deep, House, Ambient, Trip Hop, Progressive, Tech, Trance, Chillout and Lounge blend exquisitely.It's been a lot of work and a steep learning curve, but in just a few months on air, we managed to expand our network even further, meet amazing artists and Industry folks and above all, do what we love every single day! And because we never stop working, in parallel to the radio growth, we decided to push things even further: ""BeatLounge Chillout LifeStyle"", the first compilation album by BeatLounge, released onSchalldeluxe label in August 2012, marked the beginning of a dream, one which inevitably headed us towards the creation of our own label: BeatLounge Records in March 2013!Today, we are releasing the second part of what promises to be a successful and beloved series within the BLR catalogue:""BeatLounge Chillout Lifestyle 002""and which continues to generate unique andspecial atmospheres, from angelic voices, to dark trip hop melodies, passing through somewhat friendlier groovesand experimental sounds, this album clearly puts in evidence the evolution of the BeatLounge brand in general: ourradio, our label, and of course our productions!""BeatLounge Chillout Lifestyle 002"" includes 14 tracks + a Continuous DJ Mix by Tim Angrave.More than 13 THOUSAND Facebook fans can't be wrong!! :) https://www.facebook.com/beatloungeradioYou can visit our website here: http://www.beatloungerecords.comBeatLounge Chillout Lifestyle 002 – Various Artists (Compilation)01. Chris Coco – Disappearing Dining Club02. Pete Gooding & Tyrell D – Get Loaded (Tim Angrave Ambient Version)03. Motif ft. Pamela Nyambo – Strong (Padapella)04. Steen Thottrup – Save A Little Prayer05. Afterlife – Les Cellulaires06. Danny Stubbs ft. Issa – Secrets (Denis Laurent Remix)07. Gabriel Diggs feat. Geri Soriano Lightwood – Ojalá08. Karen Gibson Roc – Walk Into The Night09. Ganga – Carry You Home10. Ingo Boss & Chillwalker – Unloved (Chillwalker String Orchestra Remix)11. Matan Arkin – Star Walker12. Riccicomoto – Q’s Department13. Mariano Sinestesia – Waterfall Eyes14. X° – Volatil15. Tim Angrave – BeatLounge Chillout Lifestyle 002 Continuous DJ MixGenres Chillout | Ambient | Downtempo | DeepProduced by Alejandra Iorgulescu & Luis BlancoArtwork Diego CorreaLabel BeatLounge RecordsRelease 23 October 2013","No risks whatsoever on albums released. Upcoming releases might always run into unexpected delays, but never for more than 2 to 3 weeks of initial foreseen release date.",https://www.kickstarter.com/projects/366939575/beatlounge-records-chillout-lifestyle-002?ref=discovery_category_newest,366939575/beatlounge-records-chillout-lifestyle-002,"BeatLounge as a very rough idea was born in early 2005, as a place were my passion for electronic music and technology would merge, and worked as a weekly podcast. Life would happen and things would stay the same for many, many years until 2010 when I re-name the podcast to ""BeatLounge"", and 2 years later, in March 2012 I decide to take the next logical step: transform the weekly podcast into a 24/7 Online Radio.And because we never stop working, in parallel to the radio growth, we decided to push things even further: the creation of our own label, BeatLounge Records, in March 2013!We love music, we love working with such talented artists around the Globe, both emerging and super famous ones, but we still have a long ways to go and being an Independent label we truly need and appreciate your support to take our project to the next level! Our Main Goal:To be able to release physical copies of our albums during 2014! More than 14 THOUSAND Facebook fans can't be wrong!! :) CLICK TO VISIT OUR WEBSITE!TAKE A DRINK (CD SINGLE)01. Original Mix02. Alex ElVil Remix03. Vivi Pedraglio Rmx04. Jey Indahouse Ibiza Rmx05. Tranquility Mix by Mariano SinestesiaHouse | Deep | Tech | LoFiProduced by Alejandra Iorgulescu & Luis BlancoArtwork A.I. DesignRelease 27 May 2013BEATLOUNGE CHILLOUT LIFESTYLE 002 (COMPILATION)01. Chris Coco – Disappearing Dining Club02. Pete Gooding & Tyrell D – Get Loaded (Tim Angrave Ambient Version)03. Motif ft. Pamela Nyambo – Strong (Padapella)04. Steen Thottrup – Save A Little Prayer05. Afterlife – Les Cellulaires06. Danny Stubbs ft. Issa – Secrets (Denis Laurent Remix)07. Gabriel Diggs feat. Geri Soriano Lightwood – Ojalá08. Karen Gibson Roc – Walk Into The Night09. Ganga – Carry You Home10. Ingo Boss & Chillwalker – Unloved (Chillwalker String Orchestra Remix)11. Matan Arkin – Star Walker12. Riccicomoto – Q’s Department13. Mariano Sinestesia – Waterfall Eyes14. X° – Volatil15. Tim Angrave – BeatLounge Chillout Lifestyle 002 Continuous DJ MixChillout | Ambient | Downtempo | DeepProduced by Alejandra Iorgulescu & Luis BlancoArtwork Diego CorreaRelease 23 October 2013BEATLOUNGE MIDNIGHT LIFESTYLE (COMPILATION)01. Moby – Lie Down In Darkness (Arno Cost Remix)02. Leandro Dutra – The Raise (Original Mix)03. Huw Costin – Disconnected (Stefan Cordery Remix)04. Jesus Alonso feat. lewait! – Take a Drink, Move your Feet (Original Mix)05. Eva Pacifico – Caliente (Gabriel Diggs Scotch Bonnet Mix)06. Motif feat. Hannah Magenta – Never Let Go (Danny Stubbs Remix)07. Synapsis – Light The Way08. Alex ElVil – Black Butterfly (Original Mix)09. Gushi & Raffunk – Sound Of You (Deep Session By Riccicomoto)10. Jey Indahouse Pres.Chizsoul – Deep Rhodes (Classic Mix)11. BeatLounge Midnight Lifestyle (Continuous DJ Mix By Tim Angrave)House | Progressive | EDMProduced by Alejandra Iorgulescu & Luis BlancoAlbum Mastering Tim AngraveArtwork Diego CorreaRelease 03 June 2013INSIDE ME (CD SINGLE)01. Alex ElVíl – Inside Me (Original Mix)02. Alex ElVíl – Inside Me (Eddie Hu Remix)03. Alex ElVíl – Inside Me (Bicycle Corporation Remix)04. Alex ElVíl – Inside Me (Blaire Remix)05. Alex ElVíl – Inside Me (Mariano Sinestesia Remix) DeepHouse | Progressive | Tech | AmbientProduced by Alejandra Iorgulescu & Luis BlancoAlbum Mastering Mariano SinestesiaArtwork A.I. DesignRelease 09 December 2013LOUNGESTYLE VOL. 01 (COMPILATION)01 Mo' Horizons - Foto Viva02 Club Des Belugas ft. Brenda Boykin - Straight to Memphis03 Tape Five - Geraldines Routine (Spin Around Radio Mix)04 Riccicomoto - Emily (Dr Mabuse Organ Edit)05 Dee C'rell - Moulin Bleu06 Klangstein & Lewait - One07 Gushi & Raffunk - Check Me Out08 Mac Guffin - I Cross My Heart09 Lazy Hammock - Daybreak (Dub-Chill Mix)10 Pezlimón Sound - Ruina Total11 Matan Arkin - East12 Afterlife - Loftism13 Jey Indahouse Pres. Chizsoul ft. Lewait - Dreams from Ibiza (IndaBeach Mix)  Lounge | ElectroSwing | NuBossa | DowntempoProduced by LewaitCo-Produced by Alejandra Iorgulescu & Luis BlancoAlbum Mastering Mariano SinestesiaArtwork A.I. DesignRelease 20 Dec. 2013 ","We had a bit of a a test run with our first kickstarter project, and it was unsuccessful. We believe that it was due to 2 main factors: 1) Although we have thousands of fans, we found out that people are usually not that prone to 'donating' money, especially fans of our radio from other countries. This can stem from a variety of things, but mainly, online purchasing is not as common as it is here in the US. Our label is still too small to have it's own following. We thought that we would get our vast majority of contributions from our radio fans but it hasn't worked that way.2) We believe that the contributions we were asking were not in line with our albums market value. For example: for someone to feel encouraged to contribute, they need to know and feel that they are getting so much more than just dropping  by our website and purchasing our releases directly. We have now reviewed that, and are giving YOU a lot more for your contributions!Our main problem with our first project was probably setting the bar too high. $1000 was not a realistic goal for us, at least not to start with. We believe that a much lower one like this one will not only hit the mark, but will also encourage more contributions.There's absolutely no risks involved. All of our albums are released already. The 2 that are not for sale, will have hit all major stores by the time this campaign is over, all of our albums are finished albums and can be sent to backers as soon as the 30 days period of our campaign is over."
https://www.kickstarter.com/projects/jlplive/sensual-nude-by-jlp-tattoo-edition?ref=discovery_category_newest,jlplive/sensual-nude-by-jlp-tattoo-edition,"Well I don't suspect at this point this particular project is going to meet its goal. I would like to invite you to have look at our other current projects. Both of which have had more success and are really close to being funded.If you have already contributed to this project and would like it to succeed please keep reading.With the failure of reaching our goal for this project we decided to come at it from a different angle in raising the money. Instead of trying to raise all the money needed for the book in one go we decided to break it up into smaller more manageable projects. Essentially what we are doing is raising the money for each models shoot for the book individually. This allows us to make the goals much smaller and more likely to be reached. We will be creating three projects/additions a month featuring one model a project. (Each project/addition will have its own rewards) There will be 25+ models in total and we hope to wrap up the last project/addition late September early October. Our hopes are to start work on the book so that it can be ready before next Christmas.To make a long story short ""sensual nudes tattoo addition"" is not going to succeed so feel free to pull your funding and if you like spread it amongst the new project title ""The Naked Pixel"" series. It is the same project but coming from a different angle. Minus some of the tattoos. There are currently two projects online and a third coming online in the next day or two. The links below are to those projects. Thanks for your supporthttp://kck.st/1yEPkYk  http://kck.st/1z4vDbcSensual Nude. ""tattoo edition"" is the first in a series of artistic nude photo books I hope to assemble. This particular edition is focused on the beautiful, sensual and erotic tattooed and pierced female form. Accompanying these beautiful tattooed and pierced women will be the stories and the meanings behind their tattoos and piercings to bring you back much closer to the art within the art.Book DetailsSensual Nudes. ""tattoo edition"" is a 100 page art photo book that will be published early 2015 it will contain 25+ models showcasing their nude pierced and tattooed bodies. The book will be self published and available online as a 10x8 print on demand or as a enhanced e-book.Three formats will be produced.Funds raised will be put towards studio time, stylists, makeup artists, props, paying models, and producing books for the backers. The books will be printed in full color (some images may be black and white for artistic effect. All hardcover books will have an acknowledgment page listing major contributors of over $100 unless the individual wishes to remain anonymous.Past worksBonus round. For every $1000 we go over funding goal three random people will get an invite to the release/launch party.For every $3000 we go over the funding goal one random person will receive an invite to one of the shooting sessions.If we go over our the funding goal by $5000 all contributors will receive a bonus 8 x 10 signed print of an unpublished piece from the project.If we go over the funding goal by 10,000 all contributors will receive a free enhanced e-book of the next installment of Sensual Nudes.I have had the great opportunity of helping so many others immortalize their memories through photography, now I would like very much the opportunity to do so for myself","I have 10 years experience as a wedding photographer and model photographer.  As a wedding photographer I have had to produce high-quality photo books for many clients.  As a photographer for models doing portfolio work I have acquired many contacts with models and agents that will assure I can acquire the amount of quality models needed for this project.  I am fully aware of the risks and challenges  and I believe The risk is relatively low. If we don't reach the funding goal, then your credit card is not charged. If we reach the funding goal, then it is just a matter of printing the book and distributing it.Fortune sides with he who dares",https://www.kickstarter.com/projects/jlplive/the-naked-pixel?ref=discovery_category_newest,jlplive/the-naked-pixel,"The future of ""the naked pixel"" As you know this is a collection of tasteful and artistic nudes.  The collection will contain images from 25 different models. The timeline for the 25 installments are lined up for three new projects per month between now and October or until we complete the last of the 25 additions. Each addition has its own rewards that will be completed with that specific projects timeline. We also plan on publishing a coffee table style art book with never before seen images from each shoot. We will start work on this book shortly after the last photo shoot for the naked pixel collection.  The book will be released in three formats a 10 x 8, enhanced e-book version and a high quality limited edition 13 x 11. You're probably wondering why we decided to go the route of 25 individual projects instead of one project with one goal.  Well we did, our first attempt was to raise the money all in one go but we failed to reach our goal.  We learned a lot from the first attempt and have since changed our approach to what we are now currently seeing as individual projects.  We have had far more success proceeding down our current path.  Essentially what we have done is spread out the burden of large investments allowing those with different financial means to participate.  It also has created a nice side effect of receiving more rewards in total over the entirety of the 25 installment project.   Where your money is going.The money will be used to offset the cost of paying the model for gracing us with her nude form, studio time and of course fulfilling my obligations to our very gracious contributors.help us make this happen, it's a small goal to reach and if you can't donate spread the word Plz.Update: the second edition is live http://kck.st/1yEPkYk","The only risk to this project is of the model doesn't show up to her shoot or changes her mind. But we have that covered,  in the event that the model doesn't show or changes her mind we we will post three replacement candidates on our website and let our contributors choose the replacement model.   We have a long list models wanting to participate in this project so finding a replacement will be done with ease."
https://www.kickstarter.com/projects/1117613668/showerhead-at-indy-fringe?ref=discovery_category_newest,1117613668/showerhead-at-indy-fringe,"Showerhead focuses on Charlie, a downtrodden housewife that leaves her life behind for the world of sex, drugs, and crime. Heavily influenced by 70s B movies and the work of John Waters, Showerhead celebrates characters who usually receive no more than a passing glance. This play has been in the works for quite a while-over two years- and has evolved and transformed into its current incarnation. We've found that people tend to enjoy this show more with every exposure, and it has even has something of a cult following.This will be our first production at the Indy Fringe Festival, and we couldn't be more excited. We know that with hard work, dedication, and your help we can make this into one of the most memorable theatre experiences ever to grace the Fringe stage.","Like many theatre companies, our biggest challenge is of course securing financing. However, we are working tirelessly to self-fund our prodution, and believe that the work will speak for itself. Basically, we do not anticipate having any issues with attendance once the festival begins. We are also currently working on the casting of this show, but have many excellent actors interested in rolls.",https://www.kickstarter.com/projects/1117613668/space-til-midnight-a-monthly-comic-zine?ref=discovery_category_newest,1117613668/space-til-midnight-a-monthly-comic-zine,"Greetings! My name is Dakota Jones and I love independent art. I have been drawing since I can remember and believe it or not, this is my first comic ever. No seriously. I want to provide the community with local art and captivating stories that I feel need to be seen. It is cost effective, short and on a monthly basis. What I really want is for local art to be noticed more and have it appear more prominently in your favorite shops and homes. If you help this project succeed, you will have a new copy of Space Til Midnight every single month!","It takes a long time to make a comic look good. I have worked for months to bring you the best I can offer. Sadly, the biggest risk is not being noticed or selling my product. It happens to everyone in the art industry which is why I am confident that my story and my art will keep customers coming back."
https://www.kickstarter.com/projects/1254797348/twelve-pole-horror-film?ref=discovery_category_newest,1254797348/twelve-pole-horror-film,,"The screenplay for Twelve Pole is complete and the cast and crew have been set. Everyone is invested in the process but know that the timeline for completion is not yet currently easy to estimate. We believe we can have the film finished within a year. Advertising, distribution, and accessiblity will be challenges after the production of the film is complete.",https://www.kickstarter.com/projects/1254797348/twelve-pole-movie?ref=discovery_category_newest,1254797348/twelve-pole-movie,"Twelve Pole is a horror film about a group who purchases a home in Wayne, WV but soon find out that this home doesn't let anyone survive. Classic, grisly, and brutal horror. The expectation of this production is that it will utilize heavy prosthetic and partical effects instead of CGI. We need some help making sure this happens with as much quality as possible. The small amount we are asking will help offset the cost of making props, creating effects, and plenty of BLOOD! Any amount you can give will be appreciated and put to good use.","Our team welcomes the challenge of shooting a low budget, independent, horror film with high standards. Challenges for us include maintaining our day to day jobs in addition to organizing the overal project. Our cast and crew are committed to keeping the film production of Twelve Pole a high priority."
https://www.kickstarter.com/projects/omarbayoumi/omar-bayoumi?ref=discovery_category_newest,omarbayoumi/omar-bayoumi,"OMAR BAYOUMI is a high-end brand that will produce genderless clothing. The brand will produce tops, shirts, dresses, trousers, outerwear and many other. I have attached above the range plan that is currently at the stage of sampling. Further designs are being developed in the meantime.The eponymous brand (Omar Bayoumi) is very personal for the designer being built around his ancestries place. Combining the modern and the classic, Omar Bayoumi is a cutting-edge fashion label.Having said the word 'fusion', it is the definition of the brand's concept. Inclusivity is what the brand stands for. The brand aims to transcend beyond social norms of femininity/masculinity and modern society to create innovative garments and experiences. Raising awareness of a missing category and building a new well-established fashion house is a priority to the brand.The business' aim is to manufacture and retail luxury genderless garments (unisex apparel), with future plans of developing footwear and accessories.Minimalism and luxury lay in the core of Omar Bayoumi, while inclusivity and ageless are terms that define the target market.the MASK","The foreseen risks have to do with the current economical situation in the UK, having one of the highest market plummeting ever seen. In order to overcome, is it is planned that the brand will not only target local, but Far East and Middle East are foreseen as some of the most important buyers. One of the main challenges of the brand is to build, and help others while doing so. Collaborating with small businesses that are struggling due to the current situations, and while using profits to grow the brand, a certain percentage must be going towards promoting the art, the show and the entire GENDERLESS MOVEMENT.",https://www.kickstarter.com/projects/omarbayoumi/a-high-end-genderless-fashion-brand-clothing-for-everyone?ref=discovery_category_newest,omarbayoumi/a-high-end-genderless-fashion-brand-clothing-for-everyone,"OMAR BAYOUMI is a high-end brand that will produce genderless clothing. The brand will produce tops, shirts, dresses, trousers, outerwear and many other. I have attached above the range plan that is currently at the stage of sampling. Further designs are being developed in the meantime.The eponymous brand (Omar Bayoumi) is very personal for the designer being built around his ancestries place. Combining the modern and the classic, Omar Bayoumi is a cutting-edge fashion label.Having said the word 'fusion', it is the definition of the brand's concept. Inclusivity is what the brand stands for. The brand aims to transcend beyond social norms of femininity/masculinity and modern society to create innovative garments and experiences. Raising awareness of a missing category and building a new well-established fashion house is a priority to the brand.The business' aim is to manufacture and retail luxury genderless garments (unisex apparel), with future plans of developing footwear and accessories.Minimalism and luxury lay in the core of Omar Bayoumi, while inclusivity and ageless are terms that define the target market.","The foreseen risks have to do with the current economical situation in the UK, having one of the highest market plummeting ever seen. In order to overcome, is it is planned that the brand will not only target local, but Far East and Middle East are foreseen as some of the most important buyers. One of the main challenges of the brand is to build, and help others while doing so. Collaborating with small businesses that are struggling due to the current situations, and while using profits to grow the brand, a certain percentage must be going towards mutually helping the business that are currently at the same stage of development."
